,vacancy_id,section_id,section_title,section_body,target
1,39564357,1,предстоять заниматься,разработка приложение язык Java Jakarta E SQL NET,0
2,39564357,1,предстоять заниматься,применение REST подход разработка API,0
3,39564357,1,предстоять заниматься,разработка модификация структура база данные SQL PostgreSQL,0
4,39564357,1,предстоять заниматься,работа предметно ориентировать среда разработка,0
5,39564357,1,предстоять заниматься,приемка код внешний поставщик решение,0
6,39564357,2,ждать,опыт внедрение администрирование платформа ActiveFrame 5 программный приложение CMJ Company,1
7,39564357,2,ждать,знание алгоритмизация знание любой язык программирование предпочтительный NET SQL Java,1
8,39564357,2,ждать,опыт построение система управление контент предприятие 3 год,1
9,39564357,2,ждать,высший образование ит прикладной математика т.п.,1
10,39564357,2,ждать,опыт разработка Wild Fly,1
11,39564357,2,ждать,опыт написание unit тест,1
12,39564357,2,ждать,опыт работа XML JSON SOAP,1
13,39564357,2,ждать,опыт работа Git SVN Maven Gradle,1
14,39564357,2,ждать,опыт проработка архитектура решение умение обосновывать свой выбор,1
15,39564357,2,ждать,опыт разработка микросервис,1
16,39564357,2,ждать,опыт разработка распределить высоконагруженный система,1
17,39564357,2,ждать,опыт работа база данные,1
18,39564357,2,ждать,активный участие решение архитектурный вопрос,1
19,39564357,2,ждать,знание ооп понимание основной принцип разработка по.,1
20,39564357,3,знание система класс решение,интеграционный решение Rabit Kafka ИБМ MQ Kong,1
21,39564357,3,знание система класс решение,Веб сервер Nginx,1
22,39564357,3,знание система класс решение,сервер приложение Spring boot Tomcat Jetty,1
23,39564357,3,знание система класс решение,DB MSSQL Oracle PL SQL PostgreSql Cassandra MongoDB,1
24,39564357,3,знание система класс решение,контейнеризация Kubernetes Docker Rancher,1
25,39564357,4,предлагать,официальный оформление тк рф,3
26,39564357,4,предлагать,полный социальный пакет,3
27,39564357,4,предлагать,возможность выбрать время начало окончание работа,3
28,39564357,4,предлагать,дмс испытательный срок,3
29,39564357,4,предлагать,комфортный офис,3
30,39564357,4,предлагать,команда эксперт,3
31,39564357,4,предлагать,возможность профессиональный развитие карьерный рост,3
32,39585579,0,обязанность,администрирование развитие IT инфраструктура агентство,0
33,39585579,0,обязанность,администрирование схд сервер Windows,0
34,39585579,0,обязанность,поддержание работоспособность специализировать база Windows,0
35,39585579,0,обязанность,администрирование система виртуализация VMware vSphere,0
36,39585579,0,обязанность,поддержка единый схема аутентификация пользователь система база Active Directory,0
37,39585579,0,обязанность,участие разработка выбор внедрение новый ит сервис оптимизация существовать ит,0
38,39585579,0,обязанность,мониторинг доступность производительность система,0
39,39585579,0,обязанность,эксплуатация высоконагруженный интернет сервис,0
40,39585579,0,обязанность,выполнение эскалировать заявка второй линия поддержка,0
41,39585579,1,требование,планирование развертывание администрирование серверный операционный система сервис приложение база Windows,1
42,39585579,1,требование,опыт работа система хранение данные EMC Netapp пр.,1
43,39585579,1,требование,опыт работа SAN NAS сеть,1
44,39585579,1,требование,опыт работа распределить высоконагруженный виртуальный инфраструктура база VMware,1
45,39585579,1,требование,опыт работа Cisco IronPort,1
46,39585579,1,требование,опыт работа Cisco UCS,1
47,39585579,1,требование,знание система резервный копирование Veeam уровень эксперт,1
48,39585579,1,требование,знание следующий почтовый служба уровень эксперт Микрософт Exchange 2013 2016,1
49,39585579,1,требование,знание кистема управление база данные Микрософт SQL 2012 2016 использование,1
50,39585579,1,требование,автоматизация ит процесс задача помощь создание скрипт Powershell большинство случай,1
51,39585579,1,требование,знание принцип работа сеть уровень CCNA,1
52,39585579,1,требование,знание английский язык уровень деловой переписка,1
53,39585579,1,требование,наличие следующий сертификат знание достаточный получение MCSA SQL Server 2012,1
54,39585579,2,условие,стабильность полный соблюдение тк рф комфортный график,4
55,39585579,2,условие,отличный команда – профессионал увлеченный свой дело,4
56,39585579,2,условие,удобный местоположение – офис находиться самый центр москва шаговый доступность,4
57,39585579,2,условие,профессиональный развитие – проходить регулярный семинар тренинг также давать возможность,4
58,39585579,2,условие,комфорт – офис кафе столовая шаговый доступность множество заведение любой,4
64,38304560,1,ограничить текущий стек всякий пара,отдельный фронт TypeScript React Redux,5
65,38304560,1,ограничить текущий стек всякий пара,бэкенд Python Django база Postgres Redis,5
66,38304560,1,ограничить текущий стек всякий пара,админка свой фронт бэк стек,5
67,38304560,2,начало ждать переезд поддомен help.tinkoff.ru,допилить поиск редирект поверх старый проект отдельный сервис,1
68,38304560,2,начало ждать переезд поддомен help.tinkoff.ru,переписать бэкенд помощь админка точно прийтись отталкиваться требование старый код,1
69,38304560,2,начало ждать переезд поддомен help.tinkoff.ru,работать гибкий процесс разработка декомпозировать оценивать задача планировать спринт проводить,1
70,38304560,2,начало ждать переезд поддомен help.tinkoff.ru,общаться продакт бэкендер помощь дизайнер тестировщик специалист безопасность коллега тинькофф,1
71,38304560,2,начало ждать переезд поддомен help.tinkoff.ru,запуск прод пройти ревь отдел безопасность веб приложение тестирование команда,1
72,38304560,2,начало ждать переезд поддомен help.tinkoff.ru,запуск поддерживать проект выводить состояние MVP,1
73,38304560,3,почему это крутой,запустить проект внутри тинькофф ру путь принять интересный сложный технический,3
74,38304560,3,почему это крутой,приложение серьезный требование получить опыт работа высокий нагрузка отказоустойчивость получиться,3
75,38304560,3,почему это крутой,поработать небольшой автономный команда пожар бюрократия план итерация выстроить процесс,3
76,38304560,3,почему это крутой,делать продукт который полезный ваш близкий сотня тысяча клиент тинькофф,3
77,38304560,4,требование,уверенно владеть стэк основа язык Python Golang Rust Scala JS+TS,1
78,38304560,4,требование,знакомый паттерный проектирование синглтон адаптер,1
79,38304560,4,требование,разрабатывать API использовать спецификация OpenAPI,1
80,38304560,4,требование,знать основа микросервисный архитектура,1
81,38304560,4,требование,иметь опыт оптимизация приложение,1
82,38304560,4,требование,уметь писать unit тест,1
83,38304560,5,условие,профессиональный развитие проводить митап тренинг мастер класс огромный tech библиотека,4
84,38304560,5,условие,бесплатный вкусный обед уютный Tinkoff.сafe чай кофе фрукт кухня каждый,4
85,38304560,5,условие,забота здоровье полис дмс страховка несчастный случай льготный условие страхование,4
86,38304560,5,условие,занятие бесплатный фитнес зал Tinkoff.,4
87,38304560,5,условие,работа комфортный офис 5 минута пешком маротра динамо,4
88,38304560,5,условие,достойный твой профессиональный уровень зарплата размер обсудить собеседование,4
93,38487280,1,ключевой задача,построение непрерывный интеграция доставка CI CD,0
94,38487280,1,ключевой задача,администрирование настройка Linux система RHEL CentOS Debian,0
95,38487280,1,ключевой задача,администрирование HTTP сервер Nginx Apache HTTP Server,0
96,38487280,1,ключевой задача,написание работа SQL запрос PostgreSQL MySQL,0
97,38487280,1,ключевой задача,администрирование сервер приложение PHP FPM PHP Node.Js Redis RabbitMQ,0
98,38487280,1,ключевой задача,опыт работа система контроль версия Oit,0
99,38487280,1,ключевой задача,мониторинг доступность производительность создание проверка система мониторинг Zabbix,0
100,38487280,1,ключевой задача,автоматизация задача скриптовый язык Bash sh,0
101,38487280,2,важный,знание Linux система уровень администратор RHEL CentOS,1
102,38487280,2,важный,опыт построение непрерывный интеграция доставка CI CD,1
103,38487280,2,важный,опыт поддержка прикладной система PHP FPM PHP Node.Js Redis Nginx,1
104,38487280,2,важный,умение писать запрос работать субд PostgreSQL MySQL,1
105,38487280,2,важный,умение писать скриптовый язык Bash sh,1
106,38487280,2,важный,умение читать технический литература английский язык,1
107,38487280,2,важный,базовый знание Windows,1
108,38487280,3,плюс,знание Agile подход,2
109,38487280,3,плюс,опыт написание скрипт язык Python,2
110,38487280,3,плюс,администрирование опыт работа Apache ActiveMQ Tomcat,2
111,38487280,3,плюс,умение читать код,2
112,38487280,4,предлагать,реализовать свой потенциал создание развитие современный ит решение точно скучный,3
113,38487280,4,предлагать,конкурентный условие оплата труд фиксировать доход обсуждать результат собеседование годовой,3
114,38487280,4,предлагать,возможность карьерный профессиональный рост,3
115,38487280,4,предлагать,дмс прохождение испытательный срок,3
116,38487280,4,предлагать,корпоративный обучение,3
117,38487280,4,предлагать,оформление согласно тк рф,3
118,38487280,4,предлагать,возможность удалить работа,3
119,38487280,4,предлагать,специальный предложение финансовый продукт компания скидка партнер,3
120,38487280,4,предлагать,график работа 5 2 пн чт 9 00 18 00 пт 9 00,3
121,38487280,4,предлагать,офис экологически чистый район рядом гребной канал зеленый зона рождение,3
122,38487280,4,предлагать,корпоративный транспорт метро полежаевский кунцевский,3
124,38802856,1,каждый процесс компания иметь свой,продажа товар сима карта платеж денежный перевод,1
125,38802856,1,каждый процесс компания иметь свой,заказ интернет магазин,1
126,38802856,1,каждый процесс компания иметь свой,кредитный заявка,1
127,38802856,1,каждый процесс компания иметь свой,работа склад,1
128,38802856,1,каждый процесс компания иметь свой,логистика,1
129,38802856,1,каждый процесс компания иметь свой,клиентский аналитик весь бизнес домен включая лояльность,1
130,38802856,1,каждый процесс компания иметь свой,услуга связный трэвел многое,1
131,38802856,2,1 отладить процесс разработка,постановка ведение задача Jira,1
132,38802856,2,1 отладить процесс разработка,изменение вести система контроль версия Oit использование Bitbucket,1
133,38802856,2,1 отладить процесс разработка,использование flyway накат изменение бд весь этап dev prod,1
134,38802856,2,1 отладить процесс разработка,code review,1
135,38802856,2,1 отладить процесс разработка,code Сtрал,1
136,38802856,3,2 проработать архитектура dwh etl,актуальный схема внутренний слой DWH,1
137,38802856,3,2 проработать архитектура dwh etl,правило создание наименование объект бд,1
138,38802856,3,2 проработать архитектура dwh etl,ет TL процесс писать соответствие общий шаблон,1
139,38802856,4,3 использовать технология,основной часть хранилищ SQL Server,5
140,38802856,4,3 использовать технология,репликация витрина Vertica,5
141,38802856,4,3 использовать технология,SSIS оркестратор etl процесс,5
142,38802856,4,3 использовать технология,использование очередь RabbitMQ брокер сообщение Kafka,5
143,38802856,4,3 использовать технология,Python работа очередь сервис,5
144,38802856,5,4 свежий софт,использовать SQL Server 2017 включая SSIS планировать перейти 2019,1
145,38802856,5,4 свежий софт,Vertica обновить 9.2,1
146,38802856,5,4 свежий софт,любить новый технология стараться использовать это возможно мешать стабильность наш,1
147,38802856,6,требование,аналогичный опыт разработка ETL процесс 2 х год,1
148,38802856,6,требование,понимание технология база данные специфика Микрософт SQL Server,1
149,38802856,6,требование,хороший знание язык T SQL,1
150,38802856,6,требование,базовый знание ооп,1
151,38802856,6,требование,базовый знание Python опыт разработка язык C# Java,1
152,38802856,6,требование,способность оценивать предлагать технический решение,1
153,38802856,6,требование,навык работа команда гибкий методология ведение проект,1
154,38802856,7,обязанность,участие разработка корпоративный DWH,0
155,38802856,7,обязанность,выстраивание процесс взаимодействие различный интерфейс компания MS SQL Oracle PostgreSQL,0
156,38802856,7,обязанность,проектирование разработка новый доработка существовать витрина данные,0
157,38802856,7,обязанность,разработка ETL процедура T SQL Python SSIS,0
158,38802856,7,обязанность,поддержка доработка компонент корпоративный хранилищ данные MS SQL 2017 Vertica,0
159,38802856,7,обязанность,участие задача анализ система источник составление модель данные,0
160,38802856,8,условие,месторасположение офис метро автозаводский бизнес центр симон плаза 7 минута,4
161,38802856,8,условие,высокий уровень оплата труд обсуждать индивидуально успешный кандидат,4
162,38802856,8,условие,оформление тк рф отпуск больничный соцпакет,4
163,38802856,8,условие,профессиональный коллектив возможность развитие,4
164,39005825,0,обязанность,участие предпроектный обследование,0
165,39005825,0,обязанность,разработка проектный решение написание проектный документация установка настройка исб,0
166,39005825,0,обязанность,интеграция йоктосекунда различный источник данные,0
167,39005825,0,обязанность,участие приемой сдаточный испытание информационный система,0
168,39005825,1,требование,теоретический знание практический опыт проектирование администрирование сложный программно аппаратный комплекс,1
169,39005825,1,требование,опыт администрирование Unix Linux опыт работа оса Windows Server,1
170,39005825,1,требование,знание технология сбор данные NiFi Logstash Sqoop др. хранение обработка,1
171,39005825,1,требование,умение проектирование внедрение высоконагруженный система база данные решение,1
172,39005825,1,требование,знание технология контейнеризация Docker,1
173,39005825,1,требование,опыт область сетевой технология,1
174,39005825,1,требование,опыт работа субд написание SQL запрос Python bash powershell JavaScript,1
177,36535379,1,ждеть кандидат,знание Linux уровень администратор система,1
178,36535379,1,ждеть кандидат,понимание работа сеть IP DNS DHCP,1
179,36535379,1,ждеть кандидат,навык написание скрипт bash python,1
180,36535379,1,ждеть кандидат,опыт работа Ansible,1
181,36535379,1,ждеть кандидат,опыт администрирование бд mysql postgresql,1
182,36535379,1,ждеть кандидат,опыт администрирование эксплуатация система мониторинг zabbix prometheus,1
183,36535379,1,ждеть кандидат,опыт настройка администрирование nginx,1
184,36535379,1,ждеть кандидат,опыт работа виртуализация контейнеризация KVMLXC LXDDocker,1
185,36535379,1,ждеть кандидат,понимание базовый принцип безопасность Linux система,1
186,36535379,2,приветствоваться,опыт администрирование веб сервер gunicorn uwsgi mod_wsgi,2
187,36535379,2,приветствоваться,опыт работа настройка алерт,2
188,36535379,2,приветствоваться,опыт работа система бэкапирование baculabareos,2
189,36535379,2,приветствоваться,опыт работа vpn,2
190,36535379,2,приветствоваться,опыт администрирование сервер отправка почта eximpostfix,2
191,36535379,2,приветствоваться,опыт администрирование внтурить сервис sentry redmine gitlab elk,2
192,36535379,2,приветствоваться,опыт отражение DDOS атака,2
193,36535379,2,приветствоваться,опыт настройка эксплуатирование WAF,2
194,36535379,3,большой плюс работать технология перечислить,mongodb,2
195,36535379,3,большой плюс работать технология перечислить,cassandra,2
196,36535379,3,большой плюс работать технология перечислить,kafka,2
197,36535379,3,большой плюс работать технология перечислить,clickhouse,2
198,36535379,3,большой плюс работать технология перечислить,rabbitmq,2
199,36535379,3,большой плюс работать технология перечислить,elasticsearch,2
200,36535379,3,большой плюс работать технология перечислить,minio,2
201,36535379,3,большой плюс работать технология перечислить,ceph,2
202,36535379,3,большой плюс работать технология перечислить,оркестрация kubernetesnomad,2
203,36535379,3,большой плюс работать технология перечислить,istio,2
204,36535379,4,предлагать,тк рф белый прозрачный,3
205,36535379,4,предлагать,расширить дмс стоматология,3
206,36535379,4,предлагать,комфортный офис рядом маротра дмитровский,3
