,vacancy_id,section_id,section_title,section_body,target
4347,39407949,4,работа подразумевать минимум следующий самый,официальный трудоустройство оплачивать отпуск согласно тк,0
4348,39407949,4,работа подразумевать минимум следующий самый,белый заработный плата вид оклад карта месяц,0
4349,39407949,4,работа подразумевать минимум следующий самый,возможность удаленный формат работа работа комфортный офис москва пять минута,0
4350,39407949,4,работа подразумевать минимум следующий самый,новый оборудование кресло комфортный работа,0
4351,39407949,4,работа подразумевать минимум следующий самый,корпоративный мобильный связь счет компания,0
4352,39407949,4,работа подразумевать минимум следующий самый,медицинский обследование частный клиника,0
4353,39407949,4,работа подразумевать минимум следующий самый,участие топовый проект россия госкорпорация банк крупный холдинг,0
4354,39407949,4,работа подразумевать минимум следующий самый,неизбежный развитие наш крутой команда,0
4358,39300469,1,наш идеальный кандидат,создавать кросс браузерный кросс платформенный приложение,1
4359,39300469,1,наш идеальный кандидат,знать Javascript плюс это ES6+,1
4360,39300469,1,наш идеальный кандидат,свободно владеть HTML5 CSS3 Bootstrap JQuery,1
4361,39300469,1,наш идеальный кандидат,уверенно работать React Redux плюс опыт Vue Angular,1
4362,39300469,1,наш идеальный кандидат,уметь писать typescript строго типизировать язык,1
4363,39300469,1,наш идеальный кандидат,собирать Webpack Maven,1
4364,39300469,1,наш идеальный кандидат,делать запрос реляционный бд MongoDB Elasticsearch,1
4365,39300469,1,наш идеальный кандидат,заниматься оптимизация клиентский часть приложение,1
4366,39300469,1,наш идеальный кандидат,разбираться процесс CI CD,1
4367,39300469,1,наш идеальный кандидат,знакомый принцип автоматизировать тестирование,1
4368,39300469,1,наш идеальный кандидат,мочь ставить задача новичок,1
4369,39300469,1,наш идеальный кандидат,проводить код ревь быстро выявлять типичный ошибка код,1
4370,39300469,1,наш идеальный кандидат,иметь представление Agile сторь пойнт дейля,1
4371,39300469,2,предлагать,возможность использовать передовой технология стратегия менять жизнь человек весь мир,3
4372,39300469,2,предлагать,конкурентоспособный уровень доход годовой бонус регулярный повышение результат Performance Review,3
4373,39300469,2,предлагать,культура непрерывный обучение сертификация online offline обучение россия рубеж менторство,3
4374,39300469,2,предлагать,культура равный возможность соблюдение высокий этический стандарт,3
4375,39300469,2,предлагать,дмс первый день работа включая стоматология лучший клиника москва мо,3
4376,39300469,2,предлагать,страхование жизнь размер годовой оклад сотрудник,3
4377,39300469,2,предлагать,программа поддержка сотрудник родственник психологический юридический финансовый вопрос,3
4378,39300469,2,предлагать,программа поддержка родитель информационный портал дополнительный бонус выход возвращение отпуск,3
4379,39300469,2,предлагать,дополнительный день оплачивать отпуск год,3
4380,39300469,2,предлагать,ежемесячный денежный компенсация питание содержание автомобиль,3
4381,39300469,2,предлагать,программа корпоративный привилегия PrimeZone 1000 ведущий поставщик продукт услуга,3
4382,39300469,2,предлагать,спортивный развлекательный мероприятие счет компания,3
4386,38908010,1,предстоять,выстраивание DevOps практика,0
4387,38908010,1,предстоять,автоматизация процесс разработка контроль метрик разработка тестирование,0
4388,38908010,1,предстоять,автоматизация депло весь стенд DEV PROM,0
4389,38908010,2,технический компетенция,опыт работа год,1
4390,38908010,2,технический компетенция,знание Linuxнавык администрирование приветствоваться,1
4391,38908010,2,технический компетенция,знание Bash,1
4392,38908010,2,технический компетенция,понимание процесс CI CDL CDP,1
4393,38908010,2,технический компетенция,знание язык Python Groovy,1
4394,38908010,2,технический компетенция,желательный опыт работа Java Maven,1
4395,38908010,2,технический компетенция,опыт работа Ansible Git,1
4396,38908010,2,технический компетенция,опыт работа Jira Bitbacket,1
4397,38908010,2,технический компетенция,опыт работа SQL ORACLE,1
4398,38908010,3,ожидать,официальный оформление согласно тк рф полностью белый заработный плата отпуск,1
4399,38908010,3,ожидать,конкурентный уровень заработный плата который обсуждать собеседование,1
4400,38908010,3,ожидать,премия результат работа,1
4401,38908010,3,ожидать,ежегодный повышение уровень доход результат аттестация,1
4402,38908010,3,ожидать,график работа – стандартный гибкий подход гибкий начало окончание рабочий,1
4403,38908010,3,ожидать,корпоративный курс английский язык также собственный учебный центр доступ семинар,1
4404,38908010,3,ожидать,дмс корпоративный сотовый связь,1
4405,38908010,3,ожидать,возможность внести свой вклад реализация интересный амбициозный проект участие крупный,1
4406,38908010,3,ожидать,меняться развиваться это организовывать корпоративный отдыхвнешний обучение прочий мероприятие полезный,1
4409,39318074,1,задача,придумывать архитектура,0
4410,39318074,1,задача,программировать Go,0
4411,39318074,1,задача,обеспечивать отказоустойчивость писать сервис окружение AWS,0
4412,39318074,1,задача,готовый постоянный рост нагрузка объем обрабатывать хранимый данные,0
4413,39318074,1,задача,участвовать обсуждение новый фич развитие продукт,0
4414,39318074,2,требование,уверенный владение язык программирование Go Kotlin Java C++ Python Scala,1
4415,39318074,2,требование,опыт разработка сложный проект,1
4416,39318074,2,требование,знание классический алгоритм структура данные,1
4417,39318074,2,требование,опыт разработка Linux Unix,1
4418,39318074,3,плюс,опыт highload,2
4419,39318074,3,плюс,опыт работа MongoDB,2
4420,39318074,3,плюс,опыт работа Kubernetes,2
4421,39318074,4,условие работа,красивый удобный офис район маротра динамо аэропорт цска,4
4422,39318074,4,условие работа,релокационный пакет соискатель москва,4
4423,39318074,4,условие работа,белый зарплата,4
4424,39318074,4,условие работа,пакет акция компания,4
4425,39318074,4,условие работа,гибкий график,4
4426,39318074,4,условие работа,любой оборудование работа выбор,4
4427,39318074,4,условие работа,дмс 100 оплачивать больничный,4
4428,39318074,4,условие работа,ипотечный программа год работа,4
4429,39318074,4,условие работа,бесплатный обед ужин,4
4433,39900755,1,требование,высший технический образование,1
4434,39900755,1,требование,отличный знание Java SE 8+,1
4435,39900755,1,требование,знание принцип ооп шаблон проектирование,1
4436,39900755,1,требование,понимание микросервисный архитектура,1
4437,39900755,1,требование,опыт enterprise разработка разработка высоконагруженный сервис,1
4438,39900755,1,требование,отличный знание Spring,1
4439,39900755,1,требование,знение JUnit TestNG,1
4440,39900755,1,требование,знание Maven Gradle,1
4441,39900755,1,требование,опыт работа g RPC желательный,1
4442,39900755,1,требование,опыт работа Kafka Zuul желательный,1
4443,39900755,1,требование,знакомство Netty протокол WebSocket желательный,1
4444,39900755,2,условие,работа стабильный успешный компания топ 10 рейтинг Cnews Analytics крупный,4
4445,39900755,2,условие,место работа комфортный офис частично полный удаленный занятость,4
4446,39900755,2,условие,официальный оформление тк рф ип,4
4447,39900755,2,условие,социальный пакет дмс дополнительный компенсация обучение туризм изучение английский язык,4
4448,39900755,2,условие,гибкий график работа преимущественно команда работать 9 10.00 18 19.00,4
4449,39900755,2,условие,дружный коллектив,4
4464,39300491,2,плюс,опыт работа SAP Commerce Hybris Commerce,2
4465,39300491,2,плюс,регулярно практиковать TDD использование JUnit,2
4466,39300491,2,плюс,иметь опыт работа JS желательный Angular,2
4467,39300491,2,плюс,уметь настраивать поддерживать Tomcat,2
4468,39300491,2,плюс,пустой звук слово Maven Gradle EHCache ZKoss OData,2
4469,39300491,2,плюс,весть понимание суть вызов микросервисный подход,2
4470,39300491,3,предлагать,возможность использовать передовой технология стратегия менять жизнь человек весь мир,3
4471,39300491,3,предлагать,конкурентоспособный уровень доход годовой бонус регулярный повышение результат Performance Review,3
4472,39300491,3,предлагать,культура непрерывный обучение сертификация online offline обучение россия рубеж менторство,3
4473,39300491,3,предлагать,культура равный возможность соблюдение высокий этический стандарт,3
4474,39300491,3,предлагать,дмс первый день работа включая стоматология лучший клиника москва мо,3
4475,39300491,3,предлагать,страхование жизнь размер годовой оклад сотрудник,3
4476,39300491,3,предлагать,программа поддержка сотрудник родственник психологический юридический финансовый вопрос,3
4477,39300491,3,предлагать,программа поддержка родитель информационный портал дополнительный бонус выход возвращение отпуск,3
4478,39300491,3,предлагать,дополнительный день оплачивать отпуск год,3
4479,39300491,3,предлагать,ежемесячный денежный компенсация питание,3
4480,39300491,3,предлагать,программа корпоративный привилегия PrimeZone 1000 ведущий поставщик продукт услуга,3
4481,39300491,3,предлагать,спортивный развлекательный мероприятие счет компания,3
4482,38898444,0,задача который предстоять решать,внедрение администрирование система обеспечение иб SIEM IRP WAF IDM,0
4483,38898444,0,задача который предстоять решать,анализ защищенность IT инфраструктура туча использование специализировать,0
4484,38898444,0,задача который предстоять решать,участие расследование инцидент иб,0
4485,38898444,0,задача который предстоять решать,участие исследовательский деятельность отдел,0
4486,38898444,0,задача который предстоять решать,разработка внутренний нормативный документация,0
4487,38898444,1,ждать,опыт внедрение администрирование ELk,1
4488,38898444,1,ждать,опыт разработка Python,1
4489,38898444,1,ждать,знание Linux уровень опытный пользователь,1
4490,38898444,1,ждать,понимание принцип организация IT инфраструктура,1
4491,38898444,1,ждать,понимание актуальный проблема угроза иб особенно часть выявление реагирование инцидент,1
4492,38898444,1,ждать,знание основной система защита информация мониторинг,1
4493,38898444,1,ждать,понимание механизм выявление предотвращение атака информационный инфраструктура,1
4494,38898444,2,преимущество,опыт работа помимо мониторинг система обеспечение иб,1
4495,38898444,2,преимущество,опыт работа docker контейнер,1
4496,38898444,2,преимущество,опыт расследование инцидент иб forensic,1
4503,39413069,0,предстоять заниматься,формировать стратегия внедрение автоматический тестирование,0
4504,39413069,0,предстоять заниматься,разрабатывать критерий применимость автоматический тестирование проект исходить экономический оправданность,0
4505,39413069,0,предстоять заниматься,разрабатывать актуализировать шаблон типовой документация автоматический тестирование,0
4506,39413069,0,предстоять заниматься,подбирать инструмент автоматический тестирование политика применение,0
4507,39413069,0,предстоять заниматься,технический евангелизм применение автоматический тестирование рекомендовать инструмент политик среди специалист,0
4508,39413069,0,предстоять заниматься,экспертно поддерживать проект пресейл вопрос применение автоматический тест,0
4509,39413069,0,предстоять заниматься,помогать подбор специалист автоматический тестирование,0
4510,39413069,0,предстоять заниматься,организовывать обучение обмен знание специалист автоматический тестирование,0
4511,39413069,0,предстоять заниматься,участвовать проект автоматизация тестирование,0
4512,39413069,1,важный,иметь опыт работа роль ведущий специалист эксперт автоматический тестирование,1
4513,39413069,1,важный,уверенно знать принцип подход тестирование иметь опыт применение практика,1
4514,39413069,1,важный,уверенно разбираться технология инструмент автоматический тестирование,1
4515,39413069,1,важный,знать методология организация разработка,1
4516,39413069,1,важный,знать подход построение архитектура современный приложение,1
4517,39413069,1,важный,иметь опыт оценка проект защита оценка руководитель проект команда заказчик,1
4518,39413069,1,важный,иметь хороший коммуникативный навык,1
4519,39413069,1,важный,уметь объяснить договориться,1
4520,39413069,2,каждый галочка отсюда – дополнительный,уверенный пользователь Linux,2
4521,39413069,2,каждый галочка отсюда – дополнительный,уверенно владеть практик DevOps часть CI CD,2
4522,39413069,2,каждый галочка отсюда – дополнительный,иметь опыт проведение собеседование,2
4523,39413069,2,каждый галочка отсюда – дополнительный,иметь опыт обучение сотрудник,2
4524,39413069,3,получать,достойный зарплата точный размер премия открыто обсудить знакомство портфолио навык,1
4525,39413069,3,получать,комфорт начинать свободный место парковка мск заканчивать бесплатный вкусный питание,1
4526,39413069,3,получать,High level прокачка экспертность проект действительно крутой – сильный пополнение,1
4527,39413069,3,получать,прекрасный самочувствие нервный система порядок благодаря отзывчивый коллектив адекватный начальство,1
4529,37005844,1,роль ждать,непосредственный участие проработка требование оценка планировать задача,1
4530,37005844,1,роль ждать,подготовка тестовый сценарий план тестирование основа технический требование тестовый документация,1
4531,37005844,1,роль ждать,проведение тестирование анализ получить результат работа дефект,1
4532,37005844,1,роль ждать,настройка актуализация тестовый стенд подготовка тестовый данные,1
4533,37005844,1,роль ждать,взаимодействие бизнес заказчик разработчик администратор система вендор аналитик этап постановка,1
4534,37005844,1,роль ждать,задача улучшение процесс контроль качество команда помощь база знание тестирование,1
4535,37005844,2,ожидать,опыт тестирование 1 год,1
4536,37005844,2,ожидать,знание теория опыт применение практика часто использовать вид тестирование функциональный,1
4537,37005844,2,ожидать,понимание жизненный цикл разработка роль тестирование этап работа дефект,1
4538,37005844,2,ожидать,опыт использование система автоматизация тестирование,1
4539,37005844,2,ожидать,базовый знание SQL позволять составлять запрос анализ большой объем данные,1
4540,37005844,2,ожидать,понимание принцип Agile DevOps готовность брать ответственность цель свой команда,1
4541,37005844,3,большой плюс,желание развиваться предметный область технология платежный система современный IT технология,2
4542,37005844,3,большой плюс,желание заниматься настройка поддержка тестовый окружение,2
4543,37005844,3,большой плюс,опыт работа карточный процессинговый система,2
4544,37005844,3,большой плюс,опыт программирование Java язык Python Perl Go PL SQL,2
4545,37005844,3,большой плюс,опыт разработка автотест Cucumber,2
4546,37005844,3,большой плюс,опыт работа Jira Confluence Git Bitbucket,2
4547,37005844,3,большой плюс,опыт работа команда гибкий методология Agile Scrum Kanban,2
4555,38221164,1,обязанность,разработка отладка прикладной встраивать система компьютерный зрение семантический анализ,0
4556,38221164,1,обязанность,оценка производительность алгоритм целевой встраивать устройство,0
4557,38221164,2,требование,опыт программирование секунда село Linux менее 2 год,1
4558,38221164,2,требование,опыт программирование любой скриптовый язык Python Perl Ruby,1
4559,38221164,3,приветствоваться,опыт разработка приложение использование POSIX Linux user space API,2
4560,38221164,3,приветствоваться,опыт многопоточный программирование pthreads IPC,2
4561,38221164,3,приветствоваться,опыт отладка системный драйвер ядро Linux,2
4562,38221164,3,приветствоваться,опыт командный работа Git merge rebasecherry pick Oit flow,2
4563,38221164,3,приветствоваться,хороший знание протокол стек TCP IP Ethernet,2
4564,38221164,4,условие,достойный уровень заработный плата обсуждать успешный кандидат,4
