,vacancy_id,section_id,section_title,section_body,target
1494,39797776,5,предлагать,интересный работа новый проект развитие существовать решение команда профессионал,3
1495,39797776,5,предлагать,современный технический оснащенность,3
1496,39797776,5,предлагать,профессиональный карьерный рост,3
1497,39797776,5,предлагать,оформление соответствие тк рф,3
1498,39797776,5,предлагать,уютный офис никакой дресс код,3
1500,37044132,1,предлагать,оформление соответствие тк рф,3
1501,37044132,1,предлагать,полностью официальный заработный плата результат собеседование,3
1502,37044132,1,предлагать,график работа 5 2 09 00 18 00 10 00,3
1503,37044132,1,предлагать,основной отпуск 28 календарный день дополнительный оплачивать отпуск 5 10,3
1504,37044132,1,предлагать,материальный помощь отпуск,3
1505,37044132,1,предлагать,медицинский обслуживание ведомственный поликлиника фнс россия сотрудник член семья,3
1506,37044132,1,предлагать,льготный курортный оздоровительный лечение отдых,3
1507,37044132,1,предлагать,скидка питание столовая расположенный территория,3
1508,37044132,1,предлагать,бесплатный охранять парковка,3
1509,37044132,1,предлагать,находиться адрес год москва улица походный проезд ближайший станция метро,3
1510,37044132,2,предстоять заниматься,администрирование развитие система мониторинг Zabbix,0
1511,37044132,3,55 тысяча хост 15 миллион,расширение функционал система мониторинг путем интеграция сторонний написание скрипт,1
1512,37044132,3,55 тысяча хост 15 миллион,выполнение работа постановка мониторинг новый объект,1
1513,37044132,3,55 тысяча хост 15 миллион,формирование правило обнаружение,1
1514,37044132,3,55 тысяча хост 15 миллион,написание скрипт мониторинг нестандартный параметр,1
1515,37044132,3,55 тысяча хост 15 миллион,полноценный поддержка сервер,1
1516,37044132,3,55 тысяча хост 15 миллион,использование Pacemaker ежедневный задача,1
1517,37044132,4,пожелание кандидат,образование высший,2
1518,37044132,4,пожелание кандидат,опыт работа Zabbix,2
1519,37044132,4,пожелание кандидат,обязательно уверенный знание оор Linux Windows уровень администратор,2
1520,37044132,4,пожелание кандидат,знание основной стандартный порт протокол,2
1521,37044132,4,пожелание кандидат,понимание принцип работа система мониторинг опыт администрирование желательный Zabbix навык,2
1522,39879346,0,должностной обязанность,разворачивание поддержка Java окружение,0
1523,39879346,0,должностной обязанность,настройка Kubernetes AWS PostgreSql,0
1524,39879346,0,должностной обязанность,администрирование CI CD Jenkins Gitlab CI,0
1525,39879346,0,должностной обязанность,Moниторинг работа железо облако,0
1526,39879346,1,требование соискатель,опыт работа система оркестрация Docker контейнер Kubernetes,1
1527,39879346,1,требование соискатель,Windows Server Domains Active Directory,1
1528,39879346,1,требование соискатель,опыт администрирование сервер база данные PostgreSQL MongoDB,1
1529,39879346,1,требование соискатель,опыт администрирование мониторинг система Grafana Prometheus система логирование Graylog,1
1530,39879346,1,требование соискатель,опыт работа Vault Terraform,1
1531,39879346,1,требование соискатель,высший образование технический,1
1532,39879346,1,требование соискатель,опыт сфера IT,1
1533,39879346,1,требование соискатель,умение работать команда самостоятельно,1
1534,39879346,1,требование соискатель,английский язык низкий уровень Intermediate,1
1535,39879346,2,наш условие,постоянный динамика профессиональный развитие,4
1536,39879346,2,наш условие,обсуждать гибкий график работа 5 2,4
1537,39879346,2,наш условие,трудоустройство полный соответствие тк рф,4
1538,39879346,2,наш условие,отсутствие дресс код жесткий условие труд кофе чай печенька,4
1539,39879346,2,наш условие,дмс,4
1540,39879346,2,наш условие,возможность получить необходимость дополнительный обучение курс т.д.,4
1541,39879346,2,наш условие,работа возможный удалить вариант офис,4
1544,39203789,1,особенность проект,большой модульный maven проект,0
1545,39203789,1,особенность проект,2000 таблица sql база данные,0
1546,39203789,1,особенность проект,собственный ORM поддерживать написание sql запрос формат SQL 1999,0
1547,39203789,1,особенность проект,основной работа PostgreSQL MSSQL,0
1548,39203789,2,предстоять заниматься,оптимизировать неэффективный алгоритм,0
1549,39203789,2,предстоять заниматься,оптимизировать большой сб3 запрос,0
1550,39203789,2,предстоять заниматься,оптимизировать использование распределить кэша ehcache,0
1551,39203789,2,предстоять заниматься,реализовать решение получение обработка большой количество данные внешний система,0
1552,39203789,2,предстоять заниматься,анализировать лога дампа поток дампа память собрать метрик определять проблема,0
1553,39203789,3,работа требоваться навык умение,умение оценивать сложность алгоритм стандартный операция структура данные Эaдь.,1
1554,39203789,3,работа требоваться навык умение,хороший понимание многопоточность конкурентный доступ ресурс пул соединение пул поток,1
1555,39203789,3,работа требоваться навык умение,хороший понимание кэширование уровень приложение случай решение проблема следовать применить,1
1556,39203789,3,работа требоваться навык умение,хороший понимание сб3 умение читать большой запрос план выполнение большой,1
1557,39203789,3,работа требоваться навык умение,понимание транзакция многопоточный доступ сб3 база,1
1558,39203789,3,работа требоваться навык умение,понимание сложность иной операция который отображать план выполнение сож запрос,1
1559,39203789,4,условие работа,место работа возможный удаленный занятость офис москва воронеж казань,4
1560,39203789,4,условие работа,уровень доход зависеть знание опыт,4
1561,39203789,4,условие работа,гибкий график работа 8 час промежуток 7.00 19.00 мска,4
1562,39203789,4,условие работа,развить система наставничество отладить инфраструктура постановка контроль выполнение лучший методология,4
1564,36122045,1,основной задача,эксплуатация сервис компания число разработать внутри компания,0
1565,36122045,1,основной задача,поиск реализация эффективный решение сложный проблема,0
1566,36122045,1,основной задача,участие модернизация инфраструктура приложение,0
1567,36122045,1,основной задача,участие создание высоконагруженный масштабировать отказоустойчивый геораспределить система,0
1568,36122045,2,наш преимущество,работа серьезный нагрузка десяток тысяча запрос секунда гигабит трафик несколько,2
1569,36122045,2,наш преимущество,сложный разнообразный задача каждый сервис делать удобный надежный безопасный использование,2
1570,36122045,2,наш преимущество,широкий стек технология Linux CentOS Java ansible docker KVM mesos,2
1571,36122045,3,искать человек который,уметь конфигурировать Linux iproute2 policy routing конфигурация интерфейс алиас vlan,1
1572,36122045,3,искать человек который,иметь базовый понимание Linux анализ производительность процесс I O сеть,1
1573,36122045,3,искать человек который,иметь хороший представление работа стек TCP IP,1
1574,36122045,3,искать человек который,иметь опыт автоматизацииуправление конфигурация bash ansible,1
1575,36122045,3,искать человек который,уметь анализировать текстовый лога число большой объем использование утилит sed,1
1576,36122045,3,искать человек который,понимать принцип виртуализация виртуальный машина контейнер,1
1577,36122045,3,искать человек который,иметь базовый навык программирование python ruby perl,1
1578,36122045,3,искать человек который,владеть SQL join ы аналитический функция построение отчет,1
1579,36122045,3,искать человек который,работать http прокс nginx envoy,1
1580,36122045,3,искать человек который,работать система управление версия использовать Oit,1
1581,36122045,4,предлагать,испытательный срок – дмс стоматология возможность подключение близкий человек льготный,3
1582,36122045,4,предлагать,компенсация переезд регион,3
1583,36122045,4,предлагать,метр автозаводский бцекть омег плаза,3
1584,36122045,4,предлагать,компенсация 50 оплата парковка территория бцекть 4.000 рождение сотрудник,3
1585,36122045,4,предлагать,предоставление техника согласно пожелание,3
1586,36122045,4,предлагать,гибкий график работа,3
1587,36122045,4,предлагать,обучение участие профильный конференция – счет компания,3
1588,36122045,4,предлагать,отличный профессиональный команда развитие участие формирование наш продукт сервис,3
1590,39438960,1,обязанность,анализ UX веб ui система управление голосовой чат бот,0
1591,39438960,1,обязанность,разработка макет UI,0
1592,39438960,1,обязанность,тестирование разработать функционал,0
1593,39438960,1,обязанность,бизнес анализ заказ разработка диалог робот,0
1594,39438960,1,обязанность,разработка диалог реплик робот кодирование JSON,0
1595,39438960,1,обязанность,поддержка 1 год уровень запустить обзвон анализ лог работа система,0
1596,39438960,2,требование,высший технический образование,1
1597,39438960,2,требование,знание SQL реляционный субд JSON базовый уровень,1
1598,39438960,2,требование,понимание механизм интеграция IT система REST API,1
1599,39438960,2,требование,знание python базовый уровень приветствоваться,1
1600,39438960,2,требование,коммуникабельность системный мышление,1
1603,39851712,1,задача,разработка скрипт шифрация дешифрация данные оптимизация производительность большой набор данные,0
1604,39851712,1,задача,распределение задача член команда,0
1605,39851712,1,задача,контроль выполнение срок задача оценка производительность работа команда,0
1606,39851712,1,задача,ввод проект обучение новый член команда кураторство,0
1607,39851712,1,задача,участие проектный митинг,0
1608,39851712,1,задача,взаимодействие заказчик,0
1609,39851712,2,требование,опыт разработка Python 3 х год знание язык высокий уровень,1
1610,39851712,2,требование,опыт управление распределить команда 2 х человек,1
1611,39851712,2,требование,понимание архитектура масштабировать программный обеспечение гетерогенный вычислительный система парадигма разработка,1
1612,39851712,2,требование,английский язык уровень чтение понимание способность вести деловой переписка,1
1613,39851712,2,требование,хороший навык коммуникация командный работа,1
1614,39851712,2,требование,обучаемость ответственность внимательность аналитический мышление,1
1615,39851712,3,условие,стабильный заработный плата выплачивать день день,4
1616,39851712,3,условие,хороший корпоративный программа дмс стоматология скорый помощь вызов врач дом,4
1617,39851712,3,условие,фанат гибкий график баланс работа отдых проект возможность работать дом,4
1618,39851712,3,условие,офис оборудовать необходимый комфортный работа отдых широкий выбор чай зерновой,4
1619,39851712,3,условие,неравнодушный ваш проблема hr который обратиться очень ценить наш коллектив,4
1620,39851712,3,условие,обучение английский офис случай необходимость возможный интенсивный курс упор разговорный,4
1621,39851712,3,условие,помогать сотрудник стоять место отправлять тренинг подключать онлайн ресурс проводить,4
1622,39851712,3,условие,регион помочь переезд случай необходимость,4
1623,39851712,3,условие,ауриг славиться свой классный корпоратив тимбилдинг пицца пать интеллектуальный спортивный,4
1624,39521643,0,обязанность,подготовка аналитический материал ключевой направление налоговый бюджетный денежный кредитный тарифный,0
1625,39521643,0,обязанность,анализ международный российский статистический информация,0
1626,39521643,0,обязанность,структурирование анализ рабочий база данные,0
1627,39521643,0,обязанность,аналитический сопровождение мероприятие совещание,0
1628,39521643,0,обязанность,проведение исследование опрос вопрос социально экономический развитие,0
1629,39521643,0,обязанность,подготовка сводной отчет рамка процедура орв,0
1630,39521643,0,обязанность,подготовка материал публикация доклад,0
1631,39521643,0,обязанность,верстка презентация,0
1632,39521643,1,требование,опыт работа менее 4 х год,1
1633,39521643,1,требование,высший образование экономика,1
1634,39521643,1,требование,вуз ниулион воша мига финансовый университет мгимо рэш,1
1635,39521643,1,требование,знание MS Word Excel сводной таблица формула массив пр. PP,1
1636,39521643,1,требование,знание язык программирование Python язык запрос SQL,1
1637,39521643,1,требование,знание R SPSS Statistica приветствоваться,1
1638,39521643,1,требование,знание английский язык Advanced,1
1639,39521643,2,условие,полный занятость,4
1640,39521643,2,условие,ставка 120 тыс.руб,4
1641,35606831,0,требование,опыт работа большой объем данные,1
1642,35606831,0,требование,знание область эконометрический финансовый моделирование,1
1643,35606831,0,требование,навык работа SAS Python SQL,1
1644,35606831,0,требование,опыт работа 1 год банковский телекоммуникационный консалтинговый сфера,1
1645,35606831,1,обязанность,построение модель вероятность дефолт PD уровень потеря LGD,0
1646,35606831,1,обязанность,интеллектуальный анализ данные цель выявление скрыть связь данные сегментация данные,0
1647,35606831,1,обязанность,поиск прикладной метод моделирование новый источник данные,0
1648,35606831,2,условие работа,работа высокопрофессиональный эффективный команда постоянный развитие,4
1649,35606831,2,условие работа,офис находиться самый центр столица – воздвиженка 10,4
1650,35606831,2,условие работа,обучение интересовать направление,4
1651,35606831,2,условие работа,конкурентный заработный плата оклад квартальный премия,4
1652,35606831,2,условие работа,дмс стоматология,4
1653,35606831,2,условие работа,оплата фитнес – 70 годовой абонемент любой клуб,4
1654,35606831,2,условие работа,оплачивать курс английский 50 50,4
1655,35606831,2,условие работа,потребительский кредит зарплатный сотрудник 6.5 бонус банк “дом.рф”,4
1665,39910878,1,задача рамка работа проект стадия,коммуникация заказчик сбор требование пожелание ограничение,0
1666,39910878,1,задача рамка работа проект стадия,работа тз документ заказчик уточнение требование,0
1667,39910878,1,задача рамка работа проект стадия,декомпозиция тз предварительный оценка сложность объем работа,0
1668,39910878,1,задача рамка работа проект стадия,формирование Use Case mind map т.д.,0
1669,39910878,1,задача рамка работа проект стадия,конкурентный анализ фич кейс,0
1670,39910878,2,задача рамка работа проект разработка,работа требование бизнес постановка задача,0
1671,39910878,2,задача рамка работа проект разработка,систематизация формирование актуализация бэклог,0
1672,39910878,2,задача рамка работа проект разработка,коммуникация разработчик уточнение разъяснение бизнес логика задача,0
1673,39910878,2,задача рамка работа проект разработка,написание поддержка актуализация технический описание система документация инструкция,0
1674,39910878,3,ожидать наш будущее коллега аналитик,быстрый гибкий ум позволять быстро погружаться проект клиент переключаться скучать,1
1675,39910878,4,быстрый гибкий ум позволять быстро,понимание функционирование эффективность бизнес оперировать цифра определять MVP система думать,1
1676,39910878,4,быстрый гибкий ум позволять быстро,хороший коммуникативный навык собирать требование заказчик отвечать вопрос разработка нужный,1
1677,39910878,4,быстрый гибкий ум позволять быстро,продуктовый видение развитый технический кругозор важный знать технология использовать почему,1
1678,39910878,5,возможность обучение рост,наш команда поддерживать всячески продвигать идеология самообразование,3
1679,39910878,5,возможность обучение рост,участвовать Open Source проект оплатить часы,3
1680,39910878,5,возможность обучение рост,писать статья помочь оформить оплатить часы тратить написание,3
1681,39910878,5,возможность обучение рост,компания компенсировать ваш расход приобрести книга подкаст скринкаст,3
1682,39910878,5,возможность обучение рост,ваш работа необходимый дополнительный знание готовый оплатить необходимый мастер класс,3
